{
  "$schema": "https://json-schema.org/draft/2020-12/schema",
  "$id": "urn:tabellio:schema:validation-manifest:v0.2",
  "title": "Tabellio Product Validation Manifest",
  "type": "object",
  "required": ["schemaVersion", "id", "failFast", "requireEntireCheckpoint", "acceptance", "validators"],
  "additionalProperties": false,
  "properties": {
    "schemaVersion": { "const": "tabellio-validation/v0.2" },
    "id": { "type": "string", "minLength": 1 },
    "failFast": { "type": "boolean" },
    "requireEntireCheckpoint": { "type": "boolean" },
    "acceptance": { "$ref": "#/$defs/acceptance" },
    "validators": {
      "type": "array",
      "minItems": 1,
      "maxItems": 50,
      "items": { "$ref": "#/$defs/validator" }
    }
  },
  "$defs": {
    "validatorType": {
      "enum": ["static", "schema", "semantic", "workflow", "visual", "operational", "security"]
    },
    "boundedText": { "type": "string", "minLength": 1, "maxLength": 2000 },
    "acceptance": {
      "type": "object",
      "required": ["id", "source", "risk", "outcomes", "invariants", "forbiddenOutcomes", "requiredValidatorTypes"],
      "additionalProperties": false,
      "properties": {
        "id": { "type": "string", "minLength": 1 },
        "source": { "type": "string", "minLength": 1 },
        "risk": { "enum": ["low", "medium", "high", "critical"] },
        "outcomes": { "type": "array", "minItems": 1, "maxItems": 50, "uniqueItems": true, "items": { "$ref": "#/$defs/boundedText" } },
        "invariants": { "type": "array", "maxItems": 50, "uniqueItems": true, "items": { "$ref": "#/$defs/boundedText" } },
        "forbiddenOutcomes": { "type": "array", "maxItems": 50, "uniqueItems": true, "items": { "$ref": "#/$defs/boundedText" } },
        "requiredValidatorTypes": { "type": "array", "minItems": 1, "maxItems": 7, "uniqueItems": true, "items": { "$ref": "#/$defs/validatorType" } }
      }
    },
    "validator": {
      "type": "object",
      "required": ["id", "type", "argv", "cwd", "timeoutMs", "required", "evidence", "policy"],
      "additionalProperties": false,
      "properties": {
        "id": { "type": "string", "minLength": 1 },
        "type": { "$ref": "#/$defs/validatorType" },
        "argv": { "type": "array", "minItems": 1, "maxItems": 100, "items": { "type": "string", "minLength": 1 } },
        "cwd": { "type": "string", "minLength": 1 },
        "timeoutMs": { "type": "integer", "minimum": 100, "maximum": 3600000 },
        "required": { "type": "boolean" },
        "evidence": {
          "oneOf": [
            { "type": "null" },
            {
              "type": "object",
              "required": ["path"],
              "additionalProperties": false,
              "properties": { "path": { "type": "string", "minLength": 1 } }
            }
          ]
        },
        "policy": { "$ref": "#/$defs/policy" }
      },
      "allOf": [
        {
          "if": { "properties": { "type": { "not": { "const": "static" } } }, "required": ["type"] },
          "then": { "properties": { "evidence": { "type": "object" } } }
        }
      ]
    },
    "policy": {
      "type": "object",
      "required": ["metricThresholds", "maxCostUsd", "requireCostTelemetry"],
      "additionalProperties": false,
      "properties": {
        "metricThresholds": {
          "type": "array",
          "maxItems": 100,
          "items": {
            "type": "object",
            "required": ["metric", "operator", "value"],
            "additionalProperties": false,
            "properties": {
              "metric": { "type": "string", "minLength": 1 },
              "operator": { "enum": ["gte", "lte", "eq"] },
              "value": { "type": "number" }
            }
          }
        },
        "maxCostUsd": { "type": ["number", "null"], "minimum": 0 },
        "requireCostTelemetry": { "type": "boolean" }
      },
      "allOf": [
        {
          "if": { "properties": { "maxCostUsd": { "type": "number" } }, "required": ["maxCostUsd"] },
          "then": { "properties": { "requireCostTelemetry": { "const": true } } }
        }
      ]
    }
  }
}
